[
  {
    "id": "CA-01",
    "checkId": "CHK-01",
    "objective": "Machines by status, operating system, region, manufacturer/model, and detected SQL Server.",
    "assertion": "Informational: baseline for the other controls.",
    "statusModel": [
      "PASS",
      "WARN",
      "FAIL",
      "PARTIAL",
      "INFO",
      "N/A",
      "TODO"
    ],
    "securityModelStage": "DEFENSE",
    "securityScopes": [
      "T2"
    ],
    "claim": {
      "claimType": "inventory",
      "evidenceRequired": [
        "machines",
        "scope",
        "timestamp",
        "source"
      ],
      "absenceMeans": "NOT_OBSERVED",
      "evaluationRule": "Evidence must be scoped, timestamped, attributable to a source, and must satisfy resultCriteria; absence is never interpreted as PASS."
    },
    "mappings": {
      "riskIds": [
        "R09",
        "R10"
      ],
      "scenarioIds": [
        "AS09",
        "AS10"
      ],
      "zeroTrustPrinciples": [
        "verify-explicitly"
      ],
      "zeroTrustPillars": [
        "Endpoints"
      ]
    },
    "securityBoundaryIds": [
      "SB04",
      "SB06",
      "SB08"
    ],
    "defenseFunctions": [
      "Detect"
    ],
    "mappingConfidence": "high",
    "evidence": {
      "required": [
        "machines",
        "scope",
        "timestamp",
        "source"
      ],
      "sourceDatasets": [
        "machines"
      ],
      "decisionRule": "INFO by design (inventory, not scored): counts Arc machines by connection status, OS and SQL detection; this inventory is the denominator for the other checks."
    }
  },
  {
    "id": "CA-02",
    "checkId": "CHK-02",
    "objective": "Source of each machine (on-premises, VMware, SCVMM, AWS/GCP, OCI) and chosen service (Arc-enabled servers, multicloud connector, Arc VMware/SCVMM).",
    "assertion": "Evidence: decision recorded per source.",
    "statusModel": [
      "PASS",
      "WARN",
      "FAIL",
      "PARTIAL",
      "INFO",
      "N/A",
      "TODO"
    ],
    "securityModelStage": "MANAGEMENT",
    "securityScopes": [
      "T2",
      "Global"
    ],
    "claim": {
      "claimType": "documentary",
      "evidenceRequired": [
        "scope",
        "timestamp",
        "source"
      ],
      "absenceMeans": "UNKNOWN",
      "evaluationRule": "Evidence must be scoped, timestamped, attributable to a source, and must satisfy resultCriteria; absence is never interpreted as PASS."
    },
    "mappings": {
      "riskIds": [
        "R02",
        "R09"
      ],
      "scenarioIds": [
        "AS02",
        "AS09"
      ],
      "zeroTrustPrinciples": [
        "verify-explicitly"
      ],
      "zeroTrustPillars": [
        "Apps"
      ]
    },
    "securityBoundaryIds": [
      "SB02",
      "SB08"
    ],
    "defenseFunctions": [
      "Prevent"
    ],
    "mappingConfidence": "high",
    "evidence": {
      "required": [
        "scope",
        "timestamp",
        "source"
      ],
      "sourceDatasets": [],
      "decisionRule": "PASS when the Arc service used for each environment type (servers, SQL Server, Kubernetes, VMware/SCVMM) is documented with an owner; WARN when only part of the environments is covered. TODO until the customer's documentary evidence is recorded."
    }
  },
  {
    "id": "CA-03",
    "checkId": "CHK-03",
    "objective": "Management group, subscriptions, and resource groups per environment and region; platform separated from workloads.",
    "assertion": "Evidence: approved design.",
    "statusModel": [
      "PASS",
      "WARN",
      "FAIL",
      "PARTIAL",
      "INFO",
      "N/A",
      "TODO"
    ],
    "securityModelStage": "MANAGEMENT",
    "securityScopes": [
      "Global"
    ],
    "claim": {
      "claimType": "documentary",
      "evidenceRequired": [
        "scope",
        "timestamp",
        "source"
      ],
      "absenceMeans": "UNKNOWN",
      "evaluationRule": "Evidence must be scoped, timestamped, attributable to a source, and must satisfy resultCriteria; absence is never interpreted as PASS."
    },
    "mappings": {
      "riskIds": [
        "R09"
      ],
      "scenarioIds": [
        "AS09"
      ],
      "zeroTrustPrinciples": [
        "verify-explicitly"
      ],
      "zeroTrustPillars": [
        "Infrastructure"
      ]
    },
    "securityBoundaryIds": [
      "SB02",
      "SB08"
    ],
    "defenseFunctions": [
      "Prevent"
    ],
    "mappingConfidence": "high",
    "evidence": {
      "required": [
        "scope",
        "timestamp",
        "source"
      ],
      "sourceDatasets": [],
      "decisionRule": "PASS when Arc resources follow a documented landing zone (management group, subscription, resource group and naming standard); WARN when the design exists but is not applied to every Arc resource. TODO until the customer's documentary evidence is recorded."
    }
  },
  {
    "id": "CA-04",
    "checkId": "CHK-04",
    "objective": "Server classification and stricter controls for Tier 0.",
    "assertion": "Evidence: list of servers per tier and controls per tier.",
    "statusModel": [
      "PASS",
      "WARN",
      "FAIL",
      "PARTIAL",
      "INFO",
      "N/A",
      "TODO"
    ],
    "securityModelStage": "MANAGEMENT",
    "securityScopes": [
      "T1",
      "Global"
    ],
    "claim": {
      "claimType": "documentary",
      "evidenceRequired": [
        "scope",
        "timestamp",
        "source"
      ],
      "absenceMeans": "UNKNOWN",
      "evaluationRule": "Evidence must be scoped, timestamped, attributable to a source, and must satisfy resultCriteria; absence is never interpreted as PASS."
    },
    "mappings": {
      "riskIds": [
        "R09"
      ],
      "scenarioIds": [
        "AS09"
      ],
      "zeroTrustPrinciples": [
        "verify-explicitly"
      ],
      "zeroTrustPillars": [
        "Infrastructure"
      ]
    },
    "securityBoundaryIds": [
      "SB02",
      "SB08"
    ],
    "defenseFunctions": [
      "Prevent"
    ],
    "mappingConfidence": "high",
    "evidence": {
      "required": [
        "scope",
        "timestamp",
        "source"
      ],
      "sourceDatasets": [],
      "decisionRule": "PASS when every Arc machine has a documented tier (0/1/2) that drives controls; WARN when some machines have no tier; FAIL when Tier 0 assets are not identified. TODO until the customer's documentary evidence is recorded."
    }
  },
  {
    "id": "CA-05",
    "checkId": "CHK-05",
    "objective": "Region of each machine compared with the allowed regions (optional).",
    "assertion": "WARN if any machine is outside the allowed regions; INFO without a list.",
    "statusModel": [
      "PASS",
      "WARN",
      "FAIL",
      "PARTIAL",
      "INFO",
      "N/A",
      "TODO"
    ],
    "securityModelStage": "MANAGEMENT",
    "securityScopes": [
      "T2",
      "Global"
    ],
    "claim": {
      "claimType": "inventory",
      "evidenceRequired": [
        "machines",
        "scope",
        "timestamp",
        "source"
      ],
      "absenceMeans": "NOT_OBSERVED",
      "evaluationRule": "Evidence must be scoped, timestamped, attributable to a source, and must satisfy resultCriteria; absence is never interpreted as PASS."
    },
    "mappings": {
      "riskIds": [
        "R09"
      ],
      "scenarioIds": [
        "AS09"
      ],
      "zeroTrustPrinciples": [
        "verify-explicitly"
      ],
      "zeroTrustPillars": [
        "Data"
      ]
    },
    "securityBoundaryIds": [
      "SB02",
      "SB08"
    ],
    "defenseFunctions": [
      "Prevent"
    ],
    "mappingConfidence": "high",
    "evidence": {
      "required": [
        "machines",
        "scope",
        "timestamp",
        "source"
      ],
      "sourceDatasets": [
        "machines"
      ],
      "decisionRule": "PARTIAL when the allowed-region/data-residency policy is not supplied (regions are only listed, so compliance cannot be concluded); WARN if any machine is outside the allowed regions; PASS when every machine is inside them."
    }
  },
  {
    "id": "CA-06",
    "checkId": "CHK-06",
    "objective": "Tags of each machine compared with the recommended list (optional).",
    "assertion": "INFO when any recommended tag is missing; N/A without a list.",
    "statusModel": [
      "PASS",
      "WARN",
      "FAIL",
      "PARTIAL",
      "INFO",
      "N/A",
      "TODO"
    ],
    "securityModelStage": "MANAGEMENT",
    "securityScopes": [
      "T2"
    ],
    "claim": {
      "claimType": "inventory",
      "evidenceRequired": [
        "machines",
        "scope",
        "timestamp",
        "source"
      ],
      "absenceMeans": "NOT_OBSERVED",
      "evaluationRule": "Evidence must be scoped, timestamped, attributable to a source, and must satisfy resultCriteria; absence is never interpreted as PASS."
    },
    "mappings": {
      "riskIds": [
        "R09"
      ],
      "scenarioIds": [
        "AS09"
      ],
      "zeroTrustPrinciples": [
        "verify-explicitly"
      ],
      "zeroTrustPillars": [
        "Infrastructure"
      ]
    },
    "securityBoundaryIds": [
      "SB02",
      "SB08"
    ],
    "defenseFunctions": [
      "Prevent"
    ],
    "mappingConfidence": "high",
    "evidence": {
      "required": [
        "machines",
        "scope",
        "timestamp",
        "source"
      ],
      "sourceDatasets": [
        "machines"
      ],
      "decisionRule": "INFO by design (best practice, not scored): counts machines missing at least one of the tags env, owner, criticality, costCenter, dataClassification and patchWindow."
    }
  },
  {
    "id": "CA-07",
    "checkId": "CHK-07",
    "objective": "Registration state per subscription.",
    "assertion": "FAIL if HybridCompute, GuestConfiguration, or HybridConnectivity are not registered; WARN for the recommended ones.",
    "statusModel": [
      "PASS",
      "WARN",
      "FAIL",
      "PARTIAL",
      "INFO",
      "N/A",
      "TODO"
    ],
    "securityModelStage": "MANAGEMENT",